{
  "asset_id": "asset_batch_004",
  "asset_type": "property",
  "timestamp": "2025-07-22T18:49:57Z",
  "metrics": {
    "valuation_base_k": 6.011
  },
  "flags": {
    "anomaly": false,
    "needs_review": false
  },
  "model_meta": {
    "value_model_version": "v1",
    "value_model_name": "LGBMRegressor"
  },
  "offchain_refs": {
    "detail_report_hash": null,
    "sensor_batch_hash": null
  },
  "_logged_at": "2025-07-22T18:49:58.092630Z"
}